[
  {
    "id": "track-09",
    "track": "09",
    "unit": 1,
    "file": "audio/unit1/track-09.mp3",
    "originalName": "MindsetIELTS_L3_09.mp3",
    "durationSec": 54.544,
    "sizeBytes": 438400,
    "sha256": "06b92dd71b0ed80a93d9dfca362af327c9c54def7c73db0ccaaf44d0a18a113a",
    "exerciseId": "u1-speaking-ex-12",
    "exerciseIds": [
      "u1-speaking-ex-12",
      "u1-speaking-ex-14",
      "u1-speaking-ex-15"
    ],
    "skill": "speaking",
    "mappingStatus": "book_reference_matched",
    "contentIdentityStatus": "needs_checking",
    "audioscriptId": null,
    "cueStatus": "not_created",
    "fileStatus": "staged_original",
    "availableInApp": false
  },
  {
    "id": "track-14",
    "track": "14",
    "unit": 2,
    "file": "audio/unit2/track-14.mp3",
    "originalName": "MindsetIELTS_L3_14.mp3",
    "durationSec": 138.832,
    "sizeBytes": 1112704,
    "sha256": "56977d197e3e8c75c567dbbbdb4115bc3864e2875d0af8df55e6d7e601ea40ed",
    "exerciseId": "u2-speaking-ex-03",
    "exerciseIds": [
      "u2-speaking-ex-03"
    ],
    "skill": "speaking",
    "mappingStatus": "book_reference_matched",
    "contentIdentityStatus": "needs_checking",
    "audioscriptId": null,
    "cueStatus": "not_created",
    "fileStatus": "staged_original",
    "availableInApp": false
  },
  {
    "id": "track-15",
    "track": "15",
    "unit": 2,
    "file": "audio/unit2/track-15.mp3",
    "originalName": "MindsetIELTS_L3_15.mp3",
    "durationSec": 101.32,
    "sizeBytes": 812608,
    "sha256": "e2d95c9a89e76ed43624cc57a7b53e00eb830568069cce2c950cb0a62d7728c7",
    "exerciseId": "u2-speaking-ex-05",
    "exerciseIds": [
      "u2-speaking-ex-05"
    ],
    "skill": "speaking",
    "mappingStatus": "book_reference_matched",
    "contentIdentityStatus": "needs_checking",
    "audioscriptId": null,
    "cueStatus": "not_created",
    "fileStatus": "staged_original",
    "availableInApp": false
  },
  {
    "id": "track-16",
    "track": "16",
    "unit": 2,
    "file": "audio/unit2/track-16.mp3",
    "originalName": "MindsetIELTS_L3_16.mp3",
    "durationSec": 127.744,
    "sizeBytes": 1024000,
    "sha256": "a9c7c29ef4b6b0d9aa8f3a8dd09089bf2b2f9be184957260cf578cb9d5667178",
    "exerciseId": "u2-speaking-ex-06",
    "exerciseIds": [
      "u2-speaking-ex-06"
    ],
    "skill": "speaking",
    "mappingStatus": "book_reference_matched",
    "contentIdentityStatus": "needs_checking",
    "audioscriptId": null,
    "cueStatus": "not_created",
    "fileStatus": "staged_original",
    "availableInApp": false
  },
  {
    "id": "track-17",
    "track": "17",
    "unit": 2,
    "file": "audio/unit2/track-17.mp3",
    "originalName": "MindsetIELTS_L3_17.mp3",
    "durationSec": 85.168,
    "sizeBytes": 683392,
    "sha256": "6572cb2fe8e7b6fa8613d4ff9eaac63e032045ef568e2269d63ecca65f28a1d6",
    "exerciseId": "u2-speaking-ex-08",
    "exerciseIds": [
      "u2-speaking-ex-08"
    ],
    "skill": "speaking",
    "mappingStatus": "book_reference_matched",
    "contentIdentityStatus": "needs_checking",
    "audioscriptId": null,
    "cueStatus": "not_created",
    "fileStatus": "staged_original",
    "availableInApp": false
  },
  {
    "id": "track-18",
    "track": "18",
    "unit": 3,
    "file": "audio/unit3/track-18.mp3",
    "originalName": "MindsetIELTS_L3_18.mp3",
    "durationSec": 67.504,
    "sizeBytes": 542080,
    "sha256": "46a240b23f712347f923afc9e53cf93e9bc1b844e0412d66fc36ed58dc33bb37",
    "exerciseId": "u3-listening-ex-05",
    "exerciseIds": [
      "u3-listening-ex-05"
    ],
    "skill": "listening",
    "mappingStatus": "book_reference_matched",
    "contentIdentityStatus": "needs_checking",
    "audioscriptId": null,
    "cueStatus": "not_created",
    "fileStatus": "staged_original",
    "availableInApp": false
  },
  {
    "id": "track-19",
    "track": "19",
    "unit": 3,
    "file": "audio/unit3/track-19.mp3",
    "originalName": "MindsetIELTS_L3_19.mp3",
    "durationSec": 56.08,
    "sizeBytes": 450688,
    "sha256": "926bab578c31931377337d8940a997bc01f31f24f70599df4b62c8d1e8f885d6",
    "exerciseId": "u3-listening-ex-06",
    "exerciseIds": [
      "u3-listening-ex-06",
      "u3-listening-ex-07"
    ],
    "skill": "listening",
    "mappingStatus": "book_reference_matched",
    "contentIdentityStatus": "needs_checking",
    "audioscriptId": null,
    "cueStatus": "not_created",
    "fileStatus": "staged_original",
    "availableInApp": false
  },
  {
    "id": "track-20",
    "track": "20",
    "unit": 3,
    "file": "audio/unit3/track-20.mp3",
    "originalName": "MindsetIELTS_L3_20.mp3",
    "durationSec": 85.696,
    "sizeBytes": 687616,
    "sha256": "36fca910b7a0cc81f12e1f7f9600acf3548ccbcffff0b3bddc37307f95b84c38",
    "exerciseId": "u3-listening-ex-08",
    "exerciseIds": [
      "u3-listening-ex-08"
    ],
    "skill": "listening",
    "mappingStatus": "book_reference_matched",
    "contentIdentityStatus": "needs_checking",
    "audioscriptId": null,
    "cueStatus": "not_created",
    "fileStatus": "staged_original",
    "availableInApp": false
  },
  {
    "id": "track-21",
    "track": "21",
    "unit": 3,
    "file": "audio/unit3/track-21.mp3",
    "originalName": "MindsetIELTS_L3_21.mp3",
    "durationSec": 33.28,
    "sizeBytes": 268288,
    "sha256": "eed454293465a10ebb02751c64a674e14e68a462739d291be2d660cff191fadf",
    "exerciseId": "u3-listening-ex-09",
    "exerciseIds": [
      "u3-listening-ex-09",
      "u3-listening-ex-10"
    ],
    "skill": "listening",
    "mappingStatus": "book_reference_matched",
    "contentIdentityStatus": "needs_checking",
    "audioscriptId": null,
    "cueStatus": "not_created",
    "fileStatus": "staged_original",
    "availableInApp": false
  },
  {
    "id": "track-25",
    "track": "25",
    "unit": 3,
    "file": "audio/unit3/track-25.mp3",
    "originalName": "MindsetIELTS_L3_25.mp3",
    "durationSec": 133.984,
    "sizeBytes": 1073920,
    "sha256": "eced49f2a7ed173a09c8290d70e4bd17a42e91c4c2e3b51e7d13fe8df9984c2b",
    "exerciseId": "u3-speaking-ex-04",
    "exerciseIds": [
      "u3-speaking-ex-04"
    ],
    "skill": "speaking",
    "mappingStatus": "book_reference_matched",
    "contentIdentityStatus": "needs_checking",
    "audioscriptId": null,
    "cueStatus": "not_created",
    "fileStatus": "staged_original",
    "availableInApp": false
  },
  {
    "id": "track-26",
    "track": "26",
    "unit": 3,
    "file": "audio/unit3/track-26.mp3",
    "originalName": "MindsetIELTS_L3_26.mp3",
    "durationSec": 108.28,
    "sizeBytes": 868288,
    "sha256": "50762b9a20fc489ee758365199ff1292adb1fb713f4f007e7bb4c9f77dd752df",
    "exerciseId": "u3-speaking-ex-13",
    "exerciseIds": [
      "u3-speaking-ex-13",
      "u3-speaking-ex-14"
    ],
    "skill": "speaking",
    "mappingStatus": "book_reference_matched",
    "contentIdentityStatus": "needs_checking",
    "audioscriptId": null,
    "cueStatus": "not_created",
    "fileStatus": "staged_original",
    "availableInApp": false
  },
  {
    "id": "track-27",
    "track": "27",
    "unit": 4,
    "file": "audio/unit4/track-27.mp3",
    "originalName": "MindsetIELTS_L3_27.mp3",
    "durationSec": 172.744,
    "sizeBytes": 1384000,
    "sha256": "f069a4e3ac395c1ee61de30ec8eae3a035ca29f2a4a0f1729da647b2a2144148",
    "exerciseId": "u4-listening-ex-06",
    "exerciseIds": [
      "u4-listening-ex-06"
    ],
    "skill": "listening",
    "mappingStatus": "book_reference_matched",
    "contentIdentityStatus": "needs_checking",
    "audioscriptId": null,
    "cueStatus": "not_created",
    "fileStatus": "staged_original",
    "availableInApp": false
  },
  {
    "id": "track-28",
    "track": "28",
    "unit": 4,
    "file": "audio/unit4/track-28.mp3",
    "originalName": "MindsetIELTS_L3_28.mp3",
    "durationSec": 118.456,
    "sizeBytes": 949696,
    "sha256": "838a6ad7a511127ea0e38f8d1f01906f6effa84adde3a752184b8f4978375b34",
    "exerciseId": "u4-listening-ex-08",
    "exerciseIds": [
      "u4-listening-ex-08"
    ],
    "skill": "listening",
    "mappingStatus": "book_reference_matched",
    "contentIdentityStatus": "needs_checking",
    "audioscriptId": null,
    "cueStatus": "not_created",
    "fileStatus": "staged_original",
    "availableInApp": false
  },
  {
    "id": "track-31",
    "track": "31",
    "unit": 4,
    "file": "audio/unit4/track-31.mp3",
    "originalName": "MindsetIELTS_L3_31.mp3",
    "durationSec": 108.88,
    "sizeBytes": 873088,
    "sha256": "0d752be2158112e24243132b8ac4b66ed1a8440165f88b06e9c0363be50bc7cf",
    "exerciseId": "u4-speaking-ex-02",
    "exerciseIds": [
      "u4-speaking-ex-02",
      "u4-speaking-ex-03"
    ],
    "skill": "speaking",
    "mappingStatus": "book_reference_matched",
    "contentIdentityStatus": "needs_checking",
    "audioscriptId": null,
    "cueStatus": "not_created",
    "fileStatus": "staged_original",
    "availableInApp": false
  },
  {
    "id": "track-32",
    "track": "32",
    "unit": 4,
    "file": "audio/unit4/track-32.mp3",
    "originalName": "MindsetIELTS_L3_32.mp3",
    "durationSec": 68.104,
    "sizeBytes": 546880,
    "sha256": "4fc97175ddc2a5844ffa1e8c337debe6ed09a09c9c769892c63fe53ceb63c50d",
    "exerciseId": "u4-speaking-ex-04",
    "exerciseIds": [
      "u4-speaking-ex-04"
    ],
    "skill": "speaking",
    "mappingStatus": "book_reference_matched",
    "contentIdentityStatus": "needs_checking",
    "audioscriptId": null,
    "cueStatus": "not_created",
    "fileStatus": "staged_original",
    "availableInApp": false
  },
  {
    "id": "track-33",
    "track": "33",
    "unit": 4,
    "file": "audio/unit4/track-33.mp3",
    "originalName": "MindsetIELTS_L3_33.mp3",
    "durationSec": 88.072,
    "sizeBytes": 706624,
    "sha256": "e586e6e95c584cbec1f0dc8bab61460f0d337ab44380d722be9ad8b20397fe42",
    "exerciseId": "u4-speaking-ex-06",
    "exerciseIds": [
      "u4-speaking-ex-06"
    ],
    "skill": "speaking",
    "mappingStatus": "book_reference_matched",
    "contentIdentityStatus": "needs_checking",